{
  "schema_version": "official.factor.v0",
  "stability": "official",
  "factor_id": "official.usage-sentence-cloud",
  "version": "v0.1.0",
  "title": "Usage sentence cloud",
  "summary": "找出用户会话里反复出现的常用表达，并用词云展示高频句子。",
  "title_i18n": {
    "zh-CN": "高频使用句云",
    "en-US": "Usage sentence cloud"
  },
  "summary_i18n": {
    "zh-CN": "找出用户会话里反复出现的常用表达，并用词云展示高频句子。",
    "en-US": "Finds repeated user expressions in sessions and presents frequent sentences as a word cloud."
  },
  "compatibility": {
    "evozeus_protocol": ">=0.1.0"
  },
  "governance": {
    "owner": "evozeus-factor-maintainers"
  },
  "input_contract": {
    "event_model": "SessionEvent[]",
    "required_fields": ["events[].id", "events[].role", "events[].text"],
    "accepted_input_kinds": ["session", "project", "scan_record_set"],
    "target_types": ["session", "project", "scan_record_set"],
    "record_types": ["session_envelope"],
    "prior_result_policy": "not_required"
  },
  "evidence_contract": {
    "ref_format": "event:<event-id>",
    "privacy": "Official factors must use redacted events and stable evidence refs."
  },
  "output_contract": {
    "statuses": ["matched", "not_matched", "skipped", "error"],
    "fields": ["scores", "datasets", "presentations", "evidence_refs"],
    "dataset_semantic_types": ["high_frequency_phrase_set"],
    "presentation_components": ["builtin.word_cloud.v1", "builtin.table.v1", "builtin.json.v1"]
  },
  "test_vectors": [
    {
      "name": "usage sentence repeats across user turns",
      "input": "factors/usage-sentence-cloud/session.json",
      "expected_status": "matched"
    }
  ]
}
